A0: Plan id | B0: Plan name (Skin) | C0: period | D0: duration | E0: Amount | F0: Discount | G0: =E2*(100-F2)/100 -> Final amount | H0: Eligible Ad | I0: Bonus Ads | J0: =SUM(J2:K2) -> totads
A1: ScCode | B1: ScName | C1: Period Days | D1: Validity Days | E1: Rate Rs | F1: Disc1 % | G1: =E2*(100-F2)/100 -> Rate1 Rs | H1: Eligible Ad | I1: Bonus Ads | J1: =SUM(J2:K2) -> T.Ad. Eligible
A2: FREE | B2: Free Ad | C2: 30 | D2: 365 | E2: 0 | F2: 0 | G2: =E2*(100-F2)/100 -> 0 | H2: 2 | I2: 0 | J2: =SUM(J2:K2) -> 2
A3: FREE10 | B3: Free Ad 10 Listings | C3: 60 | D3: 365 | E3: 1500 | F3: 10 | G3: =E3*(100-F3)/100 -> 1350 | H3: 10 | I3: 10 | J3: =SUM(J3:K3) -> 20
A4: FREE25 | B4: Free Ad 25 Listings | C4: 60 | D4: 365 | E4: 2800 | F4: 10 | G4: =E4*(100-F4)/100 -> 2520 | H4: 25 | I4: 25 | J4: =SUM(J4:K4) -> 50
A5: FREE50 | B5: Free Ad 50 Listings | C5: 60 | D5: 365 | E5: 3750 | F5: 10 | G5: =E5*(100-F5)/100 -> 3375 | H5: 50 | I5: 50 | J5: =SUM(J5:K5) -> 100
A6: FREE100 | B6: Free Ad 100 Listings | C6: 60 | D6: 365 | E6: 7500 | F6: 10 | G6: =E6*(100-F6)/100 -> 6750 | H6: 100 | I6: 100 | J6: =SUM(J6:K6) -> 200
A7: FREE150 | B7: Free Ad 150 Listings | C7: 60 | D7: 365 | E7: 11250 | F7: 15 | G7: =E7*(100-F7)/100 -> 9562.5 | H7: 150 | I7: 150 | J7: =SUM(J7:K7) -> 300